commit	val_loss	objective_val_loss	pitch_val_loss	stability_pitch_range	stability_pitch_delta	stability_pitch_reversals	memory_gb	status	description
9591dcf+dirty	nan	3.669020	nan	nan	nan	0	0.0	discard	baseline_stage1_4096_safe cpu_sandbox
9591dcf+dirty	nan	2.056722	nan	nan	nan	0	0.7	keep	baseline_stage1_4096_safe mps
9591dcf+dirty	nan	1.786716	nan	nan	nan	0	0.4	keep	proxy1024_pretrain_looplm_t2_l5_sandwich
9591dcf+dirty	nan	1.590306	nan	nan	nan	0	0.4	keep	proxy1024_pretrain_looplm_t2_l5_sandwich_gate_b010
9591dcf+dirty	nan	1.708305	nan	nan	nan	0	0.4	discard	proxy1024_pretrain_looplm_t2_l5_sandwich_gate_b003
9591dcf+dirty	nan	1.584774	nan	nan	nan	0	0.4	keep	proxy1024_pretrain_looplm_t2_l5_sandwich_gate_b020
9591dcf+dirty	nan	1.536442	nan	nan	nan	0	0.4	keep	proxy1024_pretrain_looplm_t2_l5_sandwich_gate_b030
9591dcf+dirty	nan	1.461367	nan	nan	nan	0	0.4	keep	proxy1024_pretrain_looplm_t2_l5_sandwich_gate_b040
9591dcf+dirty	nan	1.820938	nan	nan	nan	0	0.6	keep	proxy2048_pretrain_looplm_t2_l5_sandwich_gate_b040
9591dcf+dirty	nan	1.355018	nan	nan	nan	0	0.3	keep	proxy1024_pretrain_looplm_t3_l4_sandwich_gate_b040
9591dcf+dirty	nan	1.267330	nan	nan	nan	0	0.4	keep	proxy1024_pretrain_looplm_t3_l4_nosandwich_gate_b040
9591dcf+dirty	nan	1.116817	nan	nan	nan	0	0.4	keep	proxy1024_pretrain_looplm_t3_l4_nosandwich_gate_b050
9591dcf+dirty	nan	1.044444	nan	nan	nan	0	0.4	keep	proxy1024_pretrain_looplm_t3_l4_nosandwich_gate_b060
9591dcf+dirty	1.630625	0.755144	2.289281	nan	nan	0	0.4	discard	proxy1024_pretrain_looplm_t3_l4_nosandwich_gate_b080
9591dcf+dirty	1.712403	1.652738	2.248694	nan	nan	0	0.4	keep	proxy1024_pretrain_looplm_t3_l4_nosandwich_gate_b005
9591dcf+dirty	1.737824	1.696976	2.350291	nan	nan	0	0.4	discard	proxy1024_pretrain_looplm_t3_l4_nosandwich_gate_b000
9591dcf+dirty	1.684362	1.573378	2.324846	nan	nan	0	0.4	discard	proxy1024_pretrain_looplm_t3_l4_nosandwich_gate_b010
9591dcf+dirty	1.649538	1.646516	2.376698	nan	nan	0	0.4	discard	proxy1024_pretrain_looplm_t3_l4_nosandwich_nogate
9591dcf+dirty	1.719962	1.647659	2.408403	nan	nan	0	0.3	discard	proxy1024_pretrain_looplm_t4_l3_nosandwich_gate_b005
9591dcf+dirty	1.758294	1.701046	2.425884	nan	nan	0	0.4	discard	proxy1024_pretrain_looplm_t3_l5_nosandwich_gate_b005
9591dcf+dirty	1.753182	1.694453	2.407435	nan	nan	0	0.3	discard	proxy1024_pretrain_looplm_t3_l4_sandwich_gate_b005
9591dcf+dirty	1.737708	1.704173	2.403089	nan	nan	0	0.4	discard	proxy1024_pretrain_looplm_t3_l4_nosandwich_gate_b003
9591dcf+dirty	1.977737	1.915400	2.499140	nan	nan	0	0.6	keep	proxy2048_pretrain_looplm_t3_l4_nosandwich_gate_b005
9591dcf+dirty	2.329634	2.274532	2.670472	1.272533	-1.224485	1	0.4	discard	stage4096_lr3e4_eb16_looplm_t3_l4_gate_b005
9591dcf+dirty	2.195144	2.109807	2.591464	1.338299	-1.288077	1	0.4	discard	stage4096_lr3e4_eb16_looplm_t3_l4_gate_b005_nospeedbackoff
9591dcf+dirty	3.478660	3.351431	3.870547	0.409349	-0.319464	1	0.4	discard	stage4096_lr3e4_eb16_mb1x16_looplm_t3_l4_gate_b005
9591dcf+dirty	3.514729	3.390984	3.821862	0.402214	-0.402214	2	0.4	keep	stage4096_lr4e4_eb16_mb1x16_looplm_t3_l4_gate_b005
9591dcf+dirty	3.542920	3.446968	3.916116	0.431623	-0.053472	3	0.4	discard	stage4096_lr5e4_eb16_mb1x16_looplm_t3_l4_gate_b005
9591dcf+dirty	3.476536	3.357295	3.888984	0.165564	-0.118509	3	0.4	discard	stage4096_lr35e4_eb16_mb1x16_looplm_t3_l4_gate_b005
9591dcf+dirty	0.000000	0.000000	0.000000	nan	nan	0	0.0	crash	stage8192_lr15e4_eb8_mb1x8_looplm_t3_l4_gate_b005
9591dcf+dirty	2.957122	2.957122	3.166293	0.842017	-0.842017	0	0.5	discard	stage8192_lr15e4_eb8_mb1x8_t1_l4
9591dcf+dirty	2.446349	2.446349	2.818830	1.419735	-1.419735	0	0.5	keep	stage8192_lr2e4_eb8_mb1x8_t1_l4
9591dcf+dirty	2.511770	2.511770	2.883671	1.183491	-1.183491	0	0.5	discard	stage8192_lr25e4_eb8_mb1x8_t1_l4
ece375f+dirty	3.893676	3.855062	4.173142	0.445014	-0.445014	0	0.6	discard	arch4096_pretrain_split0-8-0_t3_lr4e4_eb16_b005_stepemb_hi090
ece375f+dirty	3.948358	3.906408	4.117268	0.215997	-0.215997	0	0.6	discard	arch4096_pretrain_split1-6-1_t2_lr4e4_eb16_b005_stepemb_hi090
ece375f+dirty	3.887647	3.820598	4.197955	0.364455	-0.364455	0	0.6	discard	arch4096_pretrain_split1-6-1_t3_lr4e4_eb16_b005_stepemb_hi090
ece375f+dirty	3.913403	3.855638	4.216735	0.304997	-0.304997	0	0.6	discard	arch4096_pretrain_split1-6-1_t4_lr4e4_eb16_b005_stepemb_hi090
ece375f+dirty	0.000000	0.000000	0.000000	nan	nan	0	0.0	crash	arch4096_pretrain_split1-6-1_t5_lr4e4_eb16_b005_stepemb_hi090
ece375f+dirty	3.826343	3.786746	4.137692	0.248730	-0.248730	0	0.6	discard	arch4096_pretrain_split2-5-1_t2_lr4e4_eb16_b005_stepemb_hi090
ece375f+dirty	3.774086	3.701660	3.999530	0.442651	-0.442651	0	0.6	keep	arch4096_pretrain_split2-5-1_t3_lr4e4_eb16_b005_stepemb_hi090
ece375f+dirty	4.027080	3.945369	4.102582	0.371703	-0.371703	0	0.6	discard	arch4096_pretrain_split2-5-1_t4_lr4e4_eb16_b005_stepemb_hi090
ece375f+dirty	4.110587	3.965608	4.279359	0.694517	-0.694517	0	0.6	discard	arch4096_pretrain_split2-5-1_t5_lr4e4_eb16_b005_stepemb_hi090
ece375f+dirty	3.710347	3.710347	3.945407	0.266961	-0.266961	0	0.6	keep	arch4096_pretrain_baseline8l_noloop_lr4e4_eb16_hi090
ece375f+dirty	3.958512	3.917910	4.260321	0.118771	-0.118771	0	0.6	discard	arch4096_pretrain_split1-5-2_t2_lr4e4_eb16_b005_stepemb_hi090
ece375f+dirty	4.025483	3.978059	4.317449	0.083401	-0.083401	0	0.6	discard	arch4096_pretrain_split1-5-2_t3_lr4e4_eb16_b005_stepemb_hi090
ece375f+dirty	4.122551	4.079297	4.162255	0.495311	-0.495311	2	0.4	discard	stage4096_lr4e4_eb16_mb1x16_looplm_t3_l4_gate_b002_hi090
ece375f+dirty	3.836144	3.773073	4.000204	0.226105	-0.226105	0	0.4	keep	stage4096_lr4e4_eb16_mb1x16_looplm_t3_l4_gate_b005_hi090_rerun
ece375f+dirty	3.853454	3.793311	4.077297	0.409787	-0.409787	0	0.4	discard	stage4096_lr32e4_eb16_mb1x16_looplm_t3_l4_gate_b005_hi090
ece375f+dirty	4.061746	3.989631	4.209986	0.537572	-0.537572	0	0.5	discard	stage4096_lr4e4_eb32_mb2x16_looplm_t3_l4_gate_b005_hi090
ece375f+dirty	3.901259	3.893125	4.096439	0.226931	-0.226931	2	0.4	discard	stage4096_lr4e4_eb16_mb1x16_looplm_t3_l4_nogate_hi090
ece375f+dirty	3.838852	3.790926	4.006566	0.306637	-0.306637	0	0.4	discard	stage4096_lr4e4_eb16_mb1x16_looplm_t3_l4_gate_b005_sandwich_hi090
ece375f+dirty	3.775143	3.740159	3.903904	0.263087	-0.263087	2	0.3	keep	stage4096_lr4e4_eb16_mb1x16_looplm_t2_l4_gate_b005_hi090
ece375f+dirty	3.870798	3.836228	3.941068	0.283840	-0.283840	0	0.3	discard	stage4096_lr4e4_eb16_mb1x16_looplm_t2_l4_gate_b005_sandwich_hi090
ece375f+dirty	3.940841	3.902792	4.096706	0.432430	-0.432430	0	0.7	keep	stage4096_lr4e4_eb16_mb1x16_looplm_t2_l9_gate_b005_hi090
ece375f+dirty	4.180745	4.121961	4.245782	0.267884	-0.267884	0	0.6	discard	stage4096_lr4e4_eb16_mb1x16_looplm_t3_l9_gate_b005_hi090
ece375f+dirty	3.657622	3.657622	4.064021	0.312300	-0.296504	1	0.7	keep	stage4096_lr4e4_eb16_mb1x16_noloop_l9_hi090
